{
  "$schema": "http://json-schema.org/draft-07/schema#",
  "$id": "task.schema.json",
  "title": "DocsOps Task",
  "description": "A unit of work for a docs agent. Self-contained: an agent should be able to execute it with only the files referenced here plus the .docs-ops/ scaffolding.",
  "type": "object",
  "required": ["id", "tier", "type", "target_files", "instructions", "success_criteria"],
  "additionalProperties": false,
  "properties": {
    "id": {
      "type": "string",
      "pattern": "^[0-9]{4}-[a-z0-9-]+$",
      "description": "Sequential id + slug. e.g. 0001-frontmatter-audit-getting-started"
    },
    "tier": {
      "enum": ["A", "B", "C"],
      "description": "Fix tier per rubric.json fix_tiers."
    },
    "type": {
      "type": "string",
      "description": "Free-form category. Conventional values: frontmatter_audit, link_audit, parity_gap, sdk_signature_diff, snippet_validation, terminology_drift, section_reorder, parameter_fill, restructure."
    },
    "owner_hint": {
      "enum": ["claude", "copilot", "either"],
      "description": "Suggestion only; any agent may claim any task. Use 'claude' for tasks needing cross-file reasoning, 'copilot' for one-shot mechanical edits.",
      "default": "either"
    },
    "target_files": {
      "type": "array",
      "items": { "type": "string" },
      "description": "Repo-relative paths the task is allowed to read+modify. Tasks MUST NOT touch files outside this list (except .docs-ops/tasks/ and .docs-ops/evals/)."
    },
    "context_files": {
      "type": "array",
      "items": { "type": "string" },
      "description": "Repo-relative paths the agent should read but NOT modify. e.g. SDK source files, glossary, sibling platform pages.",
      "default": []
    },
    "instructions": {
      "type": "string",
      "description": "Natural-language description of what to do. Should be specific enough that any reasonable agent produces the same result."
    },
    "success_criteria": {
      "type": "object",
      "required": ["validators"],
      "properties": {
        "validators": {
          "type": "array",
          "items": {
            "type": "object",
            "required": ["name", "command"],
            "properties": {
              "name": { "type": "string" },
              "command": { "type": "string", "description": "Shell command run from repo root. Exit 0 = pass." },
              "expect_in_stdout": { "type": "string", "description": "Optional: substring that must appear in stdout for pass." }
            }
          }
        },
        "rubric_must_not_regress": {
          "type": "boolean",
          "default": true,
          "description": "If true, post-change rubric score for each target_file must be >= pre-change score."
        }
      }
    },
    "expected_outputs": {
      "type": "object",
      "description": "Optional structured outputs the task should produce alongside file edits. e.g. a report JSON.",
      "properties": {
        "report_path": { "type": "string" },
        "report_schema": { "type": "string", "description": "Path to a JSON schema the report must validate against." }
      }
    },
    "blocked_by": {
      "type": "array",
      "items": { "type": "string" },
      "description": "Task ids that must be in done/ before this task can be claimed.",
      "default": []
    },
    "created_by": { "type": "string", "description": "Agent or human who created the task." },
    "created_at": { "type": "string", "format": "date-time" }
  }
}
