{
  "id": "0088c-post-repository-renames",
  "tier": "C",
  "type": "content",
  "owner_hint": "copilot",
  "target_files": [
    ".docs-ops/evals/0087-fence-fix-triage.md"
  ],
  "context_files": [
    ".docs-ops/evals/0087-fence-fix-triage.md",
    ".docs-ops/sdk-surface/typescript.json",
    ".docs-ops/ci/check-drift.py"
  ],
  "instructions": "Cleanup cohort 3 of 5 from the 0087 FENCE_RE-fix triage. Mostly mechanical PostRepository method renames with confirmed targets in the current surface. ~10 drift pairs.\n\n## Symbols to rename (confirmed targets)\n\n| Old (drift) | New (current surface) | Pattern |\n|---|---|---|\n| `PostRepository.updatePost` | `PostRepository.editPost` | rename |\n| `PostRepository.isFlaggedByMe` | `PostRepository.isPostFlaggedByMe` | added `Post` infix |\n| `PostRepository.getPostsByIds` | `PostRepository.getPostByIds` | plural Ids → singular Id |\n| `PostRepository.postForId` | `PostRepository.getPost` | rename to `get` pattern |\n| `PostRepository.getPinnedPostsLive` | `PostRepository.getPinnedPosts` | dropped `Live` suffix |\n| `PostRepository.queryPosts` | `PostRepository.getPosts` | `query` → `get` pattern |\n| `PostRepository.deletePost` | `PostRepository.softDeletePost` (or `hardDeletePost` if context implies hard delete) | already fixed once in 0085; one more occurrence in `use-cases/social/rich-content-creation.mdx` |\n\n## Steps\n\n1. Grep `social-plus-sdk/` and `use-cases/` for each old symbol.\n2. Replace with the new name. Read the surrounding context to choose between `softDeletePost`/`hardDeletePost` where ambiguous — default to `softDeletePost` unless the doc explicitly discusses permanent deletion.\n3. Run gate. Aim for ~10 pairs cleaned up.\n\n## Out of scope\n\n- Symbols in other cohorts (0088a, b, d, e).\n- Adding new content beyond the renames.\n\n## Success criteria\n\n- All listed PostRepository drift pairs resolved.\n- No new drift pairs introduced.\n- `softDeletePost` vs `hardDeletePost` choice rationale documented per occurrence in result notes.\n\nReport in `notes`: per-symbol file count and delete-choice rationale.",
  "success_criteria": {
    "validators": [
      {
        "name": "drift_reduced",
        "command": "python3 .docs-ops/ci/check-drift.py --quiet 2>&1 | grep -oE 'candidate=[0-9]+' | head -1",
        "expect_in_stdout": "candidate="
      }
    ],
    "rubric_must_not_regress": false
  },
  "expected_outputs": {
    "report_path": ".docs-ops/evals/0087-fence-fix-triage.md"
  },
  "blocked_by": [],
  "created_by": "claude-opus-4-7",
  "created_at": "2026-05-20T16:00:00Z"
}
