{
  "id": "0021-execute-name-drift-rewrites",
  "tier": "A",
  "type": "sdk_signature_diff",
  "owner_hint": "copilot",
  "target_files": [],
  "context_files": [
    ".docs-ops/evals/fabrication-decisions.json",
    ".docs-ops/sdk-surface/typescript.json",
    ".docs-ops/evals/ts-accuracy-drift.json"
  ],
  "instructions": "Execute the auto-fixable rewrites identified in `.docs-ops/evals/fabrication-decisions.json`. ONLY act on rows where `classification == \"NAME_DRIFT_TS_RENAMED\"`. These rows already have a specific, surface-verified `recommended_action` of the form `REWRITE_TO:<target>` — that is the action to apply. The `decision` field on these rows is intentionally NULL: the meeting between CTO and SDK lead is for the OTHER buckets, not these. Treat the `recommended_action` as authoritative for this task.\n\n**target_files is intentionally empty** — discover the affected files from each row's `locations[]` in the decision sheet. You are authorized to edit any .mdx file under social-plus-docs/ for the specific rewrites below.\n\nREWRITES TO APPLY (driven by the decision sheet, NOT hardcoded — read the JSON):\n\nFor each row where `classification == \"NAME_DRIFT_TS_RENAMED\"`, the `ref` tells you what to find and the `recommended_action` tells you what to do. Below are the *patterns* you'll encounter — apply the right pattern per row:\n\n**Pattern 1 — Drop named import, use Amity global** (most rows):\n  recommended_action begins with `REWRITE_TO:Amity.X (global ambient type; remove import)`\n  - Remove the bare name from the `import { ... } from '@amityco/ts-sdk'` list. If the list becomes empty, remove the entire import line.\n  - Replace every reference to the bare name in the code block body with `Amity.X` (preserve generic params: `LiveCollection<T>` → `Amity.LiveCollection<T>`).\n  - Examples in this batch: `AmityComment` → `Amity.Comment`, `AmityCommentReferenceType` → `Amity.CommentReferenceType`, `AmityPost` → `Amity.Post`, `AmityPoll` → `Amity.Poll`, `AmityUser` → `Amity.User`, `AmityPollAnswerType` → `Amity.PollAnswerType`, `AmityContentFlagReason` → `Amity.ContentFlagReason`, `StreamResolutions` → `Amity.StreamResolution` (note the typo fix — also drop import).\n\n**Pattern 2 — AmityClient → Client (no import needed)**:\n  recommended_action: `REWRITE_TO:Client (no import needed; Amity.Client is a global ambient type)`\n  - The ref is `import AmityClient`. Drop the name from the import list (remove line if empty).\n  - In the body, replace bare `AmityClient` type references with `Amity.Client`. NOTE: do NOT confuse this with the runtime `Client` namespace (which IS imported normally for things like `Client.login`). `AmityClient` was being used as a TYPE in these docs, not a value.\n\n**Pattern 3 — getLinkPreviewMetadata → method on Client**:\n  recommended_action: `REWRITE_TO:Client.getLinkPreviewMetadata (method on Client, not a standalone import)`\n  - Drop `getLinkPreviewMetadata` from the import list. If `Client` is not already imported, ADD it.\n  - Replace bare `getLinkPreviewMetadata(...)` calls in the body with `Client.getLinkPreviewMetadata(...)`.\n\n**Pattern 4 — Repository namespace swap**:\n  recommended_action: `REWRITE_TO:ChannelRepository.Moderation.addRole` (or `.removeRole`)\n  - The ref is `CommunityRepository.Moderation.addRole` / `.removeRole`. Replace with `ChannelRepository.Moderation.addRole` / `.removeRole` in the code block.\n  - If `ChannelRepository` is not already imported in the same file, add it to the import list (or replace `CommunityRepository` if no longer needed elsewhere in the file).\n\n**Pattern 5 — Method rename within same namespace**:\n  recommended_action: `REWRITE_TO:PostRepository.createRoomPost`\n  - The ref is `PostRepository.createLivestreamPost`. Replace with `PostRepository.createRoomPost`. No import changes.\n\nRULES (consistent with 0006/0010/0016/0017/0018):\n  - Apply only inside ```typescript / ```ts / ```javascript / ```js fenced code blocks. Check for indented blocks inside `<Step>`, `<Tab>`, `<Accordion>` MDX components — manual handling if needed.\n  - Preserve all argument lists, generic params, chained calls verbatim.\n  - Do NOT modify prose, frontmatter, or other code blocks on the same page.\n  - If a call site doesn't fit the pattern cleanly (signature appears to have changed, multi-name destructure, etc.), STOP that occurrence, leave it unedited, and report `needs_signature_review` in notes.\n  - Do NOT act on rows with any classification OTHER than `NAME_DRIFT_TS_RENAMED`. The other buckets are for the CTO+SDK-lead meeting.\n\nReport in `notes`: per file, line-by-line list of (old, new) replacements; total replacements applied; any `needs_signature_review` cases; per-pattern count.",
  "success_criteria": {
    "validators": [
      {
        "name": "all_name_drift_refs_gone_from_drift_report",
        "command": "python3 .docs-ops/extractors/typescript-extractor.py > /dev/null && python3 .docs-ops/validators/ts-accuracy-validator.py > /dev/null && python3 -c \"import json; d=json.load(open('.docs-ops/evals/fabrication-decisions.json')); r=json.load(open('.docs-ops/evals/ts-accuracy-drift.json')); name_drift_refs={row['ref'] for row in d['rows'] if row['classification']=='NAME_DRIFT_TS_RENAMED'}; flagged=set(); [flagged.add(i.get('ref')) for f,iss in r['issues_by_file'].items() for i in iss if i.get('ref') in name_drift_refs]; [flagged.add(f'import {i[\\\"import_name\\\"]}') for f,iss in r['issues_by_file'].items() for i in iss if f'import {i.get(\\\"import_name\\\",\\\"\\\")}' in name_drift_refs]; print('FAIL: still flagging '+str(flagged)) if flagged else print('OK'); import sys; sys.exit(1 if flagged else 0)\"",
        "expect_in_stdout": "OK"
      }
    ],
    "rubric_must_not_regress": true
  },
  "blocked_by": [],
  "created_by": "claude-opus-4-7",
  "created_at": "2026-05-17T13:20:00Z"
}
