{
  "id": "0073-pr-bot-ts-prototype",
  "tier": "B",
  "type": "infrastructure",
  "owner_hint": "copilot",
  "target_files": [
    ".docs-ops/pr-bot/README.md",
    ".docs-ops/pr-bot/auto-update-from-sdk.py",
    ".docs-ops/pr-bot/render-pr-comment.py",
    ".github/workflows/sdk-drift-watcher.yml"
  ],
  "context_files": [
    ".docs-ops/extractors/typescript-extractor.py",
    ".docs-ops/validators/ts-accuracy-validator.py",
    ".docs-ops/sdk-surface/typescript.json",
    ".docs-ops/tasks/done/0010-ts-rename-batch-from-triage.json",
    ".docs-ops/tasks/done/0021-execute-name-drift-rewrites.json"
  ],
  "instructions": "Build the SDK→docs PR-bot prototype. TS-only first per established phased approach.\n\n## Architecture\n\nDaily GH Action in this docs repo:\n  1. Clone AmityTypescriptSDK at HEAD\n  2. Regenerate TS surface against that source\n  3. Diff candidate vs committed `.docs-ops/sdk-surface/typescript.json`\n  4. If no diff → exit cleanly (no PR — most days)\n  5. If diff → classify changes, apply unambiguous auto-renames, open/update draft PR with structured comment\n\nNo SDK-repo changes needed (polling, not push-based). Q1 confirmed: daily cron is fine.\n\n## Part A — GH Action workflow (`.github/workflows/sdk-drift-watcher.yml`)\n\n```yaml\nname: SDK Drift Watcher\non:\n  schedule:\n    - cron: '0 8 * * *'  # daily 8am UTC\n  workflow_dispatch:      # also manually triggerable\nconcurrency:\n  group: sdk-drift-watcher\n  cancel-in-progress: false  # don't stomp on a running bot\njobs:\n  watch:\n    runs-on: ubuntu-latest\n    permissions:\n      contents: write\n      pull-requests: write\n    steps:\n      - uses: actions/checkout@v4\n        with:\n          fetch-depth: 0\n      - name: Checkout AmityTypescriptSDK\n        uses: actions/checkout@v4\n        with:\n          repository: AmityCo/AmityTypescriptSDK\n          path: ../AmityTypescriptSDK\n      - uses: actions/setup-python@v5\n        with: { python-version: '3.12' }\n      - name: Run PR-bot\n        env:\n          SP_SDKS_ROOT: ${{ github.workspace }}/..\n          GH_TOKEN: ${{ secrets.GITHUB_TOKEN }}\n        run: python3 .docs-ops/pr-bot/auto-update-from-sdk.py --platform typescript\n```\n\nVerify the AmityTypescriptSDK checkout path works with the repo's existing `SP_SDKS_ROOT` env var convention used by the TS extractor.\n\n## Part B — Main script (`auto-update-from-sdk.py`)\n\nCLI: `python3 auto-update-from-sdk.py --platform typescript [--dry-run]`.\n\nFlow:\n  1. Run TS extractor to produce a CANDIDATE surface at a temp path (don't overwrite the committed one yet).\n  2. Load BASELINE surface from `.docs-ops/sdk-surface/typescript.json`.\n  3. Compute diff:\n     - **ADDED**: refs in candidate, not in baseline\n     - **REMOVED**: refs in baseline, not in candidate\n     - **RENAMED** (heuristic): a REMOVED + ADDED pair where the file:line is the same OR the new name is similar (Levenshtein < 0.3 of the longer name). Conservative — when uncertain, classify as separate REMOVED + ADDED.\n  4. If all three categories are empty → exit 0 (no PR).\n  5. Re-run the TS validator against the CANDIDATE surface to find newly-flagged refs in the docs.\n  6. Apply auto-renames for the high-confidence RENAMED pairs ONLY (use the established 0021/0061 pattern — text substitution inside ```typescript/```ts code blocks; preserve everything else).\n  7. Commit changes to a new branch `bot/sdk-update-<YYYY-MM-DD>` (or append to existing open bot branch if one is already open — see Part D).\n  8. Open or update a draft PR via `gh pr create --draft` (or `gh pr edit`).\n  9. Add a structured comment via `render-pr-comment.py` describing what changed.\n  10. Update the committed `.docs-ops/sdk-surface/typescript.json` to the new candidate IN THE PR'S BRANCH (so the regex validator stays consistent).\n\n## Part C — PR comment renderer (`render-pr-comment.py`)\n\nProduces a structured markdown comment for the draft PR:\n\n```markdown\n## 🤖 SDK Drift Watcher — daily auto-update\n\n**SDK**: AmityTypescriptSDK @ `<short-sha>` (<commit message first line>)\n**Compared against**: `.docs-ops/sdk-surface/typescript.json` @ commit `<short-sha>`\n\n### Surface diff\n\n- **Added** (<count>): new APIs since last run — not auto-documented; review for whether they need docs\n- **Removed** (<count>): APIs no longer in SDK — may need docs cleanup\n- **Renamed** (<count>): refs auto-rewritten in docs (clean substitutions only)\n\n### Auto-rewrites applied\n\n<per-file list with line refs, e.g.>\n- `social-plus-sdk/social/comments/query-comment.mdx:42` — `oldName` → `newName`\n\n### Needs your review\n\n<list of REMOVED refs that affect documented code blocks, or ADDED refs that might warrant new docs>\n\n### What this PR is\n\nThis PR was opened by the daily SDK drift watcher. The auto-rewrites are\nsignature-verified against the new SDK surface. The REMOVED items above are\nflagged for your judgment — they may be intentional removals, in which case\nthe docs need cleanup, or unintentional, in which case the SDK PR needs review.\n\n### How to merge\n\nThis is a draft PR. Convert to ready, run the gate locally if needed, then\nmerge. No further bot action needed.\n```\n\n## Part D — Append-to-existing-PR logic\n\nIf an open PR with branch name pattern `bot/sdk-update-*` already exists, don't create a new one — push to its existing branch and update its comment. Avoids PR spam if the SDK changes multiple days in a row before someone reviews.\n\nUse `gh pr list --state open --label bot --json number,branch` to find existing bot PRs (add the `bot` label to created PRs so we can filter).\n\n## Part E — README\n\nBrief: what this is, how it runs (GH Action daily), how to manually trigger (workflow_dispatch), what to do when a draft PR appears, how to disable temporarily (comment out the cron). Include a 'When this WON'T work' section (e.g., if the SDK repo becomes private or moves).\n\n## Out of scope (for v1)\n\n- iOS / Android / Flutter PR-bots — same shape; replicate after TS proves the pattern.\n- Push-based (repository_dispatch from SDK repos) — daily polling is fine per user choice.\n- Auto-merge — Q3 was C: auto-draft PR + comment. Human merges.\n- Notification beyond the PR itself (Slack, etc.) — Q4 was 'no need to notify anyone'. The PR appears in the repo's PR list; that's the notification.\n- Surface caching across runs — fine to re-extract every day.\n\n## Success criteria (LOOSE — this is infrastructure that runs in CI, not a one-shot local task)\n\n- `.github/workflows/sdk-drift-watcher.yml` syntactically valid.\n- `auto-update-from-sdk.py` runs locally with `--dry-run` against the current repo without crashing (logs would-be actions but doesn't open a PR).\n- README explains the daily flow clearly.\n- Workflow file passes GH Actions YAML lint (can be verified by `gh workflow view` once committed; OK to defer to first actual run).\n\nReport in `notes`: design decisions you made (e.g., Levenshtein threshold for RENAMED detection); known limitations (e.g., GH_TOKEN may need broader perms for cross-repo checkout); first dry-run output if you tested locally; reminder for the user to verify the workflow has the right secrets/permissions before the first scheduled run.",
  "success_criteria": {
    "validators": [
      {
        "name": "pr_bot_artifacts_in_place_and_dry_run_works",
        "command": "test -f .github/workflows/sdk-drift-watcher.yml && test -f .docs-ops/pr-bot/auto-update-from-sdk.py && test -f .docs-ops/pr-bot/render-pr-comment.py && test -f .docs-ops/pr-bot/README.md && python3 .docs-ops/pr-bot/auto-update-from-sdk.py --platform typescript --dry-run 2>&1 | tee /tmp/dryrun.out | tail -10 && echo OK",
        "expect_in_stdout": "OK"
      }
    ],
    "rubric_must_not_regress": false
  },
  "blocked_by": [],
  "created_by": "claude-opus-4-7",
  "created_at": "2026-05-19T21:00:00Z"
}
