{
  "id": "0061-ios-auto-rename-batch",
  "tier": "A",
  "type": "sdk_signature_diff",
  "owner_hint": "copilot",
  "target_files": [],
  "context_files": [
    ".docs-ops/tasks/done/0060.result.json",
    ".docs-ops/integration-tests/ios/results/latest.json",
    ".docs-ops/sdk-surface/ios.json"
  ],
  "instructions": "Auto-execute the unambiguous renames from 0060's 42 REAL_BUG findings. Same shape as TS task 0021 (NAME_DRIFT_TS_RENAMED auto-fix batch) — only act on high-confidence exact substitutions; leave ambiguous/structural changes for the iOS-SDK-lead meeting (which task 0062 will prep).\n\n## Source of truth\n\nRead 0060's REAL_BUG findings (in `.docs-ops/tasks/done/0060.result.json` notes field). Cross-check against current `.docs-ops/integration-tests/ios/results/latest.json` failures to ensure each ref still fails (don't try to fix things already fixed).\n\n## What counts as AUTO_RENAME (act on these)\n\nA finding qualifies for auto-rename ONLY IF all of these hold:\n  1. Single-target, single-name substitution: `OldName` → `NewName` where both are exact identifiers.\n  2. Successor verified in surface: `NewName` exists in `.docs-ops/sdk-surface/ios.json` under a sensible path.\n  3. Arity / structure unchanged: name swap only, no arg additions/removals, no closure-arity changes, no insertion of new statements.\n  4. Surrounding code still parses cleanly with the new name in place.\n\nKnown auto-rename candidates from 0060's report (verify each before applying):\n  - `AmityChannelQuery` → `AmityChannelQueryOptions`\n  - `AmityChannelUpdateBuilder` → `AmityChannelUpdateOptions`\n  - `AmityChannelParticipation` → `AmityChannelMembership`\n  - `.object` → `.snapshot` (on AmityObject<T> patterns — verify each call site is on an AmityObject)\n  - `AmityFileRepository(client: client)` → `AmityFileRepository()` (no-arg init — drop the client argument)\n  - Any other findings that are clearly OldName → NewName per the 0060 enumeration\n\n## What does NOT qualify (defer to 0062 / iOS SDK lead meeting)\n\n  - Signature changes: `init(userId:displayName:authToken:completion:)` → `init(...sessionHandler:)` (arg restructure)\n  - Closure-arity changes: `observe { x, y, z in }` → `observe { x, y in }` (callback signature redesign)\n  - Enum-case rewrites where the mapping isn't 1:1 (`AmityChannelMembershipFilter.member` → ? — `.member` doesn't have an obvious single replacement; `.all`, `.mute`, `.ban` are the only valid cases)\n  - Removed-without-replacement: `AmityError doesn't exist` (no obvious successor)\n  - Method-call vs property-access changes: `token.invalidate()` on optional → `token?.invalidate()` (null-safety, not a rename)\n  - Anything ambiguous: leave it; 0062 produces a decision sheet for the iOS SDK lead.\n\n## Rules\n\n- Apply only inside ```swift fenced code blocks.\n- Per-occurrence: verify the surrounding context still compiles after the rename. If anything looks off, STOP that occurrence and leave it for the meeting.\n- Preserve all arguments, chained calls, comments verbatim.\n- Do NOT modify prose, frontmatter, or unrelated code blocks.\n- Watch for indented blocks inside MDX components — handle manually if FENCE_RE misses them (same caveat as prior NAME_DRIFT batches).\n\n## After applying\n\nRe-run `python3 .docs-ops/integration-tests/ios/extract-blocks.py && python3 .docs-ops/integration-tests/ios/run-tests.py`. Target: failed count drops by ~the number of auto-renames applied.\n\nReport in `notes`: per-file (line, old, new) replacements; total auto-renames applied; per-finding count of items DEFERRED to 0062 with reason (signature change / closure arity / enum-case ambiguity / no successor); new pass/skip/fail counts.",
  "success_criteria": {
    "validators": [
      {
        "name": "ios_failures_decreased_or_explained",
        "command": "python3 -c \"import json; d=json.load(open('.docs-ops/integration-tests/ios/results/latest.json')); s=d['stats']; failed=s.get('blocks_failed',0); print(f'iOS failures now: {failed}'); assert failed <= 35, f'expected meaningful drop from 42; failed={failed}. If less progress, check notes for why.'\"",
        "expect_in_stdout": "iOS failures now"
      }
    ],
    "rubric_must_not_regress": false
  },
  "blocked_by": [],
  "created_by": "claude-opus-4-7",
  "created_at": "2026-05-19T11:00:00Z"
}
