{
  "id": "0052-flutter-doc-as-test-framework",
  "tier": "B",
  "type": "infrastructure",
  "owner_hint": "copilot",
  "target_files": [
    ".docs-ops/integration-tests/flutter/README.md",
    ".docs-ops/integration-tests/flutter/pubspec.yaml",
    ".docs-ops/integration-tests/flutter/analysis_options.yaml",
    ".docs-ops/integration-tests/flutter/preamble.dart",
    ".docs-ops/integration-tests/flutter/pages.json",
    ".docs-ops/integration-tests/flutter/extract-blocks.py",
    ".docs-ops/integration-tests/flutter/run-tests.py",
    ".docs-ops/integration-tests/flutter/results/latest.json"
  ],
  "context_files": [
    ".docs-ops/integration-tests/preamble.d.ts",
    ".docs-ops/integration-tests/pages.json",
    ".docs-ops/integration-tests/extract-blocks.py",
    ".docs-ops/integration-tests/run-tests.py",
    ".docs-ops/integration-tests/tsconfig.json",
    ".docs-ops/integration-tests/README.md",
    ".docs-ops/sdk-surface/flutter.json"
  ],
  "instructions": "Build the Flutter analog of the TS doc-as-test framework. Same value model: extract ```dart code blocks from high-traffic docs, type-check against the real `amity_sdk` package using `dart analyze`, report pass/fail/skip. Goal: protect the Western customer cohort (social-heavy, Flutter-user-base) the same way TS doc-as-test protects Eastern.\n\nNew subdirectory: `.docs-ops/integration-tests/flutter/` (sibling to the TS framework, which stays at the integration-tests/ root). Future iOS / Android frameworks will get their own subdirs in the same pattern.\n\n## Part A — Pubspec + analysis_options\n\n`pubspec.yaml` declares amity_sdk as a local path dependency pointing at the sibling repo via `SP_SDKS_ROOT` (use the same env-var convention as the TS extractor — default to the docs repo's parent dir; document the override in README):\n\n```yaml\nname: docs_ops_flutter_tests\ndescription: Type-check Flutter doc snippets against the real amity_sdk source.\nenvironment:\n  sdk: '>=3.0.0 <4.0.0'\ndependencies:\n  amity_sdk:\n    path: ../../../../Amity-Social-Cloud-SDK-Flutter-Internal\n```\n\n(The path is relative to the pubspec's directory. From `.docs-ops/integration-tests/flutter/pubspec.yaml`, four `../` to reach `sp-sdks/`, then into the SDK repo.)\n\nVerify: `dart pub get` in that directory should resolve cleanly. If the path doesn't work because of worktree weirdness, fall back to wrapping `dart pub get` with `SP_SDKS_ROOT` and constructing the path dynamically before each run.\n\n`analysis_options.yaml` — strict analysis mode, but tolerate the unused-locals warnings that doc snippets routinely produce (e.g., a snippet showing `final foo = await ...` where `foo` is for show-only):\n\n```yaml\ninclude: package:lints/recommended.yaml\nanalyzer:\n  errors:\n    unused_local_variable: ignore\n    unused_import: ignore\nlinter:\n  rules: {}\n```\n\n## Part B — Preamble: wrap each block in a function body\n\nDart doesn't have a direct equivalent to TypeScript's `declare const`. The cleanest approach: wrap each extracted block in an `async` function that already has the context variables in scope.\n\n`preamble.dart` — defines a single function shape that the extractor wraps each block with. Conceptually:\n\n```dart\n// preamble.dart — context for doc snippets. NOT used directly; the extractor\n// wraps each extracted block in a function with these parameters in scope.\nimport 'package:amity_sdk/amity_sdk.dart';\n\nFuture<void> docSnippet({\n  required String apiKey,\n  required String userId,\n  required String displayName,\n  required String channelId,\n  required String subChannelId,\n  required String messageId,\n  required String postId,\n  required String communityId,\n  required String commentId,\n  required String pollId,\n  required String fileId,\n  required AmityChannel channel,\n  required AmityMessage message,\n  required AmityPost post,\n  required AmityComment comment,\n  required AmityCommunity community,\n}) async {\n  // <SNIPPET_BODY> (extractor inserts each block here)\n}\n```\n\nVerify each named SDK type (`AmityChannel`, `AmityMessage`, etc.) exists in `.docs-ops/sdk-surface/flutter.json`. If a type doesn't exist (e.g., the Flutter SDK uses a different name), drop it from the preamble and note in your run report — be conservative; false declarations cause false negatives.\n\n## Part C — Page list (`pages.json`)\n\nReuse the SAME high-traffic page set as the TS framework (`../pages.json` for reference). Pages without any `dart` blocks will produce zero output — that's fine. Add `flutter-quick-start.mdx` explicitly since it's the Flutter entry point even though it wasn't in the TS list.\n\nWrite out the full list (mirror the TS pages.json structure: chat_track + social_track + shared) plus the Flutter quickstart in a `flutter_specific` section. Resolve `enumerate:` entries at extract time.\n\n## Part D — Block extractor (`extract-blocks.py`)\n\nMirror the TS extractor's structure. Differences:\n  - Only extract blocks tagged ```dart (NOT typescript / ts / etc.).\n  - For each block, generate a `.dart` file in `results/extracted/` with the preamble wrapper:\n\n```dart\n// source: <page>:<start>-<end>\nimport 'package:amity_sdk/amity_sdk.dart';\n\nFuture<void> docSnippet({\n  required String apiKey,\n  required String userId,\n  // ... (same params as preamble.dart)\n}) async {\n  // <BLOCK_CONTENT>\n}\n```\n\n  - The block's own `import` statements get hoisted to the TOP of the file (above the wrapper). If the block has imports, dedupe them against the wrapper's import.\n  - Naming: same slug pattern as TS (`<page-slug>-block-<N>.dart`).\n  - Honor `<!-- doc-as-test: skip -->` and `{/* doc-as-test: skip */}` markers exactly like the TS extractor does.\n\n## Part E — Test runner (`run-tests.py`)\n\nFor each `.dart` file in `results/extracted/`:\n  - Run `dart analyze <file>` (or `dart analyze --packages=.dart_tool/package_config.json <file>` if needed for the local-path dep)\n  - Exit 0 + no errors emitted = PASS\n  - Errors emitted = FAIL; capture them\n  - Warnings emitted = still PASS but record warning count\n\nDart analyze error codes have names like `undefined_method`, `argument_type_not_assignable`, etc. — NOT the TSxxxx numeric codes. Adapt the gate policy from 0051 accordingly:\n\n  - Errors of class `error` (severity: error) → BLOCKING (real type/API drift)\n  - Errors of class `warning` (severity: warning) → WARNING (non-blocking)\n  - Lints (info-level) → ignore\n\nEmit `results/latest.json` with the same schema as TS doc-as-test, but include a `severity_by_error` count and use Dart-style error names instead of TS codes.\n\n## Part F — README + .gitignore + first run\n\n`README.md` — brief: what this is, how to run locally (`cd .docs-ops/integration-tests/flutter && dart pub get && python3 run-tests.py`), where the report lives.\n\nUpdate top-level `.gitignore`: add `.docs-ops/integration-tests/flutter/results/extracted/*.dart` and `.docs-ops/integration-tests/flutter/.dart_tool/` and `.docs-ops/integration-tests/flutter/.packages` and `.docs-ops/integration-tests/flutter/pubspec.lock`.\n\nRUN the framework end-to-end. Capture first-run `latest.json`. Expect 60-80% pass rate on first attempt (the TS framework hit 84%; Dart is a bit stricter on type inference so possibly lower). Don't try to fix failures in this task; report them in notes for the next round (mirror the 0048 → 0049 → 0050 iteration that worked for TS).\n\n## Out of scope\n\n- Wiring into `check-drift.py` — separate follow-up after the Flutter framework reaches >=95% pass+skip (same shape as TS gate-wiring in 0051).\n- iOS / Android doc-as-test — separate per-platform tasks later.\n- Fixing the Flutter SDK to add `dart` analyze setup — assume the SDK already builds; if not, flag in notes.\n\n## Success criteria (LOOSE — framework build, not a quality gate yet)\n\n- Framework runs end-to-end.\n- `results/latest.json` is produced with the documented schema.\n- At least 30 Dart blocks were extracted (sanity check that the pages were scanned and have Dart content).\n- At least one block PASSES (sanity check that the toolchain works — if zero pass, the pubspec / preamble is wrong, not the docs).\n\nReport in `notes`: stats from the first run; top 10 most common failure reasons (e.g., undefined_method vs argument_type_not_assignable); estimate of preamble gaps vs real doc drift; any pages with 0 dart blocks (just an FYI — those pages weren't authored to cover Flutter); any Flutter-specific quirks encountered (extension methods, named constructors, factory pattern, etc.).",
  "success_criteria": {
    "validators": [
      {
        "name": "flutter_framework_runs_and_produces_valid_report",
        "command": "test -f .docs-ops/integration-tests/flutter/results/latest.json && python3 -c \"import json; d=json.load(open('.docs-ops/integration-tests/flutter/results/latest.json')); assert 'stats' in d and 'failures' in d; assert d['stats'].get('blocks_extracted',0)>=30, f'too few blocks: {d[\\\"stats\\\"].get(\\\"blocks_extracted\\\")}'; assert d['stats'].get('blocks_passed',0)>=1, 'zero blocks passed — toolchain likely broken'; print('OK')\"",
        "expect_in_stdout": "OK"
      }
    ],
    "rubric_must_not_regress": false
  },
  "expected_outputs": {
    "report_path": ".docs-ops/integration-tests/flutter/results/latest.json"
  },
  "blocked_by": [],
  "created_by": "claude-opus-4-7",
  "created_at": "2026-05-18T14:00:00Z"
}
